id,question_category,person_id,human_answers,ai_answers,semantic_similarity_score,overall_simulation_match_score,content_recall,content_precision,content_f1,unsupported_addition_rate,omission_rate,main_failure_type,content_comparison_summary
5,product preferences,s_human,"for my face i mostly use korean products like 'some by me', 'axis-y', 'beauty of joseon' for sunscreen.","i mostly buy skincare products from korean brands like 'some by mi' for their aha, bha, pha toner, and axis-y for their niacinamide serum because they work well for my oily, acne-prone skin i also use sunscreen by beauty of joseon since it feels light and effective these brands are transparent about their ingredients and have natural, organic options that i prefer",0.842139482498169,2,1.0,0.4,0.57,0.6,0.0,changed reasoning,"The AI answer fully preserves all the brands mentioned by the human, including the specific product type for one brand (sunscreen). However, the AI adds a significant amount of new information, including specific product names for two brands and several reasons/preferences (e.g., suitability for oily/acne-prone skin, transparency, natural/organic options) that were not stated in the human's original answer. This leads to high recall but low precision due to the numerous unsupported additions."
3,shopping behavior,g_human,i almost always get all my personal care products (which are being close to being empty) when doing grocery shopping in my nearest full-service supermarket. this feels the most convenient and time-efficient to me.,"i typically purchase my personal care products from the supermarket it's convenient, and i can easily find the brands i recognize and trust plus, i like to see the product sizes and designs before buying",0.8491313457489014,2,0.5,0.6,0.55,0.4,0.5,unsupported additions,"The AI answer preserved 50% of the human's original content, accurately capturing the typical purchase of personal care products from a supermarket due to convenience. However, it omitted several specific details and reasons, such as the trigger for purchase (items being empty), the context of grocery shopping, and the time-efficiency aspect. The AI also introduced new reasons for shopping at the supermarket, including finding recognized brands and the preference to see product sizes and designs, which were not supported by the human's original statement."
25,brand loyalty,c_human,"as i said i would rebuy a brand if the product is working for me, has a good affortable price and smells good","I’d say I’m pretty likely to repurchase if a brand works well for me. I mean, if it keeps my skin feeling good and smells nice, I’m happy. I also really like when a brand cares about sustainability—whether it’s how they package stuff or the ingredients they use. And of course, price matters too. I’m not looking to spend a lot on products that don’t make a difference. As long as it feels nice, doesn’t irritate my skin, and isn’t crazy expensive, I’ll definitely stick with it!",0.6814006567001343,3,1.0,0.3076923076923077,0.4705882352941176,0.6923076923076923,0.0,unsupported additions,"The AI answer fully preserved all four key factors mentioned by the human: likelihood to repurchase, product effectiveness, affordability, and pleasant smell. However, the AI significantly expanded on these points and introduced several new factors and details not present in the original human answer, such as specific skin benefits, sustainability, the 'feel' of the product, and a stronger statement of loyalty. This led to perfect recall but low precision due to the high number of unsupported additions."
2,shopping behavior,s_human,"i usually order my face products online from yesstyle page that has the korean skin products i need, but then when it comes to body shampoo i go to supermarkets or drugstores like dm.","i typically purchase my personal care products from online stores like yesstyle and soko glam because they offer a wide range of korean skincare brands and provide detailed ingredient lists i also appreciate that they often include free samples, which lets me try new products before committing plus, their transparency and reliability make me feel confident in my choices 😊",0.7980625033378601,1,0.6,0.375,0.4615384615384616,0.625,0.4,changed behavior,"The AI answer preserves some key details about online purchases for face products from YesStyle and the reason for Korean skincare. However, it completely omits the human's stated behavior of buying body shampoo from physical stores like supermarkets or drugstores (e.g., dm). The AI also introduces several new reasons and preferences not mentioned by the human, such as Soko Glam, detailed ingredient lists, free samples, trying new products, and feelings about transparency/reliability."
26,brand loyalty,s_human,"if i am happy with the quality of the product, i stick to the brand, but i do not care much of the brand rather then the product itself.","I'm highly likely to repurchase my preferred personal care brands if they consistently deliver effective results, use clean and organic ingredients, have minimalistic and sustainable packaging, and align with my values of sustainability and ethical practices.",0.6668095588684082,1,0.5,0.4,0.4444,0.6,0.0,changed preference,"The AI successfully preserved the human's primary reason for brand loyalty, which is product quality leading to repurchase. However, the AI significantly contradicted the human's stated indifference to the brand itself by introducing multiple brand-specific factors (ingredients, packaging, and values) that were not mentioned by the human. This led to a moderate recall for the preserved content but low precision due to the substantial amount of unsupported and contradictory information added by the AI."
